{
  "title": "岬の灯",
  "genre": [
    "海洋幻想譚"
  ],
  "premise": "岬の灯台守見習いの澪が、疎遠になった幼なじみの凪とともに停止した灯台の原因を追い、町全体で灯を守る仕組みを作ろうとする。",
  "required_elements": [
    "岬の灯台",
    "停止原因の調査",
    "疎遠になった幼なじみ",
    "町全体で灯を守る仕組み"
  ],
  "avoid": [
    "主人公だけが全責任を負う結末",
    "説明だけで謎を解決する場面"
  ],
  "ending_preference": "町が灯を守る意思を持ち、澪と凪が再点灯を見届ける。",
  "volume_count": 4,
  "language": "ja"
}
